keyword,volume
inondation cave que faire,1
comment fixer un recuperateur d eau au mur,2
fonctionnement du surpresseur,3
comment fonctionne une pompe de relevage,4
comment mettre de la pression dans un surpresseur,5
marques tracteurs français,6
tracteur carburant,7
augmenter pression eau,8
tracteur francais,9
comment augmenter la pression d'eau dans un tuyau,10
fonctionnement pompe vide cave,11
schema de fonctionnement d'une pompe de relevage,12
pompe piscine fonctionne mais n'aspire plus,13
faut il fixer un recuperateur d'eau au mur,14
pompe gnr libre service,15
reglage pression eau,16
augmenter la pression d eau,17
ou trouver du gnr,18
surpresseur fonctionnement,19
pompe de relevage vinaigre blanc,20
pompe vide cave fonctionnement,21
fixation murale recuperateur d'eau,22
comment fixer un recuperateur d'eau au mur,23
augmenter pression d eau insuffisante,24
pompe de relevage fonctionnement,25
station gnr libre service,26
comment augmenter la pression d'eau,27
augmenter la pression eau,28
tracteur français,29
fonctionnement surpresseur eau,30
comment vider une cuve à fioul sans pompe,31
regler pression eau,32
installation pompe de relevage sous sol,33
réglage pression pompe à eau,34
pression circuit d'eau maison,35
fonction du relais thermique,36
ou trouver du gnr en libre service,37
marque tracteur français,38
probleme de pompe de relevage,39
tracteur marque francaise,40
réglage pression eau maison,41
quelle pression d eau dans une maison,42
marques de tracteurs français,43
role du relais thermique,44
pression d eau dans une maison,45
comment augmenter la pression de l'eau,46
a quoi sert un relais thermique,47
cuve 1000 litres gel hiver,48
fixation recuperateur d'eau,49
marque de tracteur francaise,50
réglage surpresseur,51
pression eau maison 4 bars,52
marque de tracteur ancien français,53
reglage surpresseur,54
fonctionnement pompe de relevage,55
comptabilisation adblue,56
fonction d'un relais thermique,57
probleme pompe de relevage,58
fonction relais thermique,59
relais thermique fonction,60
augmenter pression eau maison,61
ou trouver du gnr en station service,62
tracteur de marque francaise,63
fioul tracteur,64
schéma pompe de relevage,65
comment installer une pompe de relevage pour machine à laver,66
nettoyage cuve eau de pluie enterrée,67
comment augmenter pression eau,68
quel carburant pour un tracteur agricole pour un particulier,69
surpresseur qui se déclenche tout le temps,70
comment installer une pompe de relevage dans un sous-sol,71
pompe de relevage panne,72
comment fonctionne un surpresseur,73
pompe de relevage sous-sol,74
pompe gnr autour de moi,75
marque tracteur francais,76
relais thermique,77
réserve adblue camion combien de km,78
rouler au rouge astuce,79
carte station gnr,80
relai thermique,81
reglage pression surpresseur,82
role relais thermique,83
relais thermiques,84
comment installer une pompe de relevage dans un sous sol,85
relais thermique fonctionnement,86
marque francaise de tracteur,87
schema installation pompe de surface,88
schéma installation pompe de surface,89
gnr station,90
rouler au gnr,91
cuve fioul enterrée durée vie,92
marque de tracteur français,93
fonctionnement surpresseur,94
surpresseur eau fonctionnement,95
sous sol inondé que faire,96
relais thermique role,97
tracteurs français,98
voyant adblue combien de km,99
tracteur agricole francais,100
surpresseur reglage,101
stockage carburant,102
tracteur français marque,103
remplacer adblue par eau déminéralisée,104
comment augmenter la pression d eau,105
réglage pression surpresseur,106
pression d eau maison,107
a quoi sert le relais thermique,108
pompe de relevage schema,109
augmenter la pression d'eau,110
role d'un relais thermique,111
pompe de relevage probleme,112
symptôme circulateur chaudière hs,113
peut on récupérer l'eau de pluie,114
station service gnr,115
panne pompe de relevage,116
pression d'eau dans une maison,117
ou acheter du gnr,118
calcul hmt,119
pompe a eau tourne mais n'aspire pas,120
station service gnr autour de moi,121
quel pression eau maison,122
pression eau maison,123
pression eau dans une maison,124
tracteur agricole français,125
pression surpresseur,126
station gnr autour de moi,127
augmenter pression d'eau insuffisante,128
peut on laisser une pompe vide cave dans l'eau,129
fonctionnement pompe de relevage eaux usées,130
fonctionnement pompe eau,131
fonctionnement pompe de relevage eaux pluviales,132
adblue combien de kilometre,133
contrôle réglementaire cuve fioul,134
pompe vider piscine,135
vidange cuve fuel,136
pression d'eau maison,137
a quoi sert un surpresseur,138
carburant tracteur,139
tracteur fabriqué en france,140
où trouver du gnr autour de moi,141
pompe de relevage en panne,142
pression eau maison 2 bars,143
pompe de relevage sous sol,144
cave inondée que faire,145
entretien de pompe de relevage,146
station gnr,147
fonctionnement pompe a eau,148
quelle pression eau maison,149
un surpresseur,150
adblue camion,151
nettoyer pompe de relevage,152
nettoyage pompe de relevage,153
comment nettoyer une pompe de relevage,154
schéma récupération eau de pluie pour wc,155
type de raccord plomberie,156
pompe de relevage eaux usées fonctionnement,157
fioul tracteur,158
inondation sous sol que faire,159
produit nettoyage pompe de relevage,160
nettoyer une pompe de relevage,161
pourquoi mon surpresseur ne tient pas la pression,162
comment régler la pression d'eau,163
adblue tous les combien de km,164
problème pompe à eau maison,165
voyant adblue fiat ducato combien de km,166
adblue combien de km,167
a quoi sert une pompe de relevage,168
station service délivrant du fioul à la pompe,169
relais de protection thermique,170
comment vider l'eau d'une cave sans pompe,171
installer pompe de relevage,172
ma pompe à eau tourne tout le temps,173
vider cuve fioul,174
eau dans une cave,175
kit fixation recuperateur d'eau,176
recuperation tva sur essence,177
pompe de relevage machine a laver,178
pompe de relevage machine à laver,179
fonctionnement pompe à eau,180
inondation cave,181
pompe de relevage pour lave linge,182
réparer flotteur pompe de relevage,183
marques de tracteurs,184
réserve adblue renault t combien de km,185
hauteur manométrique,186
nettoyage cuve,187
pompe à eau qui tourne à vide,188
pompe de relevage pour machine à laver,189
pompe relevage lave linge,190
comment fonctionne une pompe à eau,191
récupération tva essence,192
pompe de relevage pour machine a laver,193
composant adblue,194
cave inondée nappe phréatique,195
cave inondée,196
marque de tracteurs agricoles,197
stockage carburant réglementation,198
gnr dans voiture diesel,199
comment avoir plus de pression dans la douche,200
pompe de relevage pour machine à laver en sous-sol,201
pompe a eau demarre et s'arrete,202
adblue tous les combien de kilomètres,203
pompe relevage machine à laver,204
produit nettoyant pompe de relevage,205
recuperateur eau de pluie resistant au gel,206
vidange cuve fioul,207
pompe pour vider piscine,208
pompe de relevage pour machine à laver en sous sol,209
recuperer eau de pluie,210
pompe de relevage lave linge,211
comment installer une pompe de relevage,212
event cuve fioul norme,213
cave inondée que faire,214
reparer flotteur pompe de relevage,215
récupérer de l'eau de pluie,216
pompe de relevage pour sous sol,217
eau dans la cave nappe phréatique,218
combien de km avec adblue,219
réglage pression vessie surpresseur,220
vide sanitaire inondé,221
tracteur carburant,222
hmt pompe,223
installer un recuperateur d eau,224
vidange cuve à fioul,225
augmenter la pression d eau douche,226
hauteur manometrique totale,227
inondation sous sol quoi faire,228
augmenter la pression d'eau douche,229
difference adblue 22241 et 22241-1,230
surpresseur qui se déclenche tout le temps,231
récupérer l'eau de pluie,232
hauteur manométrique totale,233
relais thermique symbole,234
inondation sous-sol quoi faire,235
comment augmenter la pression d'eau sans surpresseur,236
recuperer tva carburant,237
problème surpresseur marche par à coup,238
surpresseur pour augmenter la pression d eau,239
récupération tva sur essence,240
schema recuperation eau de pluie pour wc,241
comment fonctionne une pompe,242
remplacer adblue par urine,243
réglementation cuve fioul intérieur,244
fonction pompe de relevage,245
pourquoi ma pompe à eau ne monte pas en pression,246
adblue tous les combien,247
vide sanitaire cave,248
récupération eau de pluie réglementation,249
gasoil gnr dans voiture,250
hauteur manométrique pompe,251
gnr autour de moi,252
marque de tracteur,253
pompe puit surpresseur,254
adblue voyant,255
prix adblue en station,256
déduction tva essence,257
pompage vide sanitaire,258
récupération eau de pluie wc,259
tva carburant recuperable,260
combien de temps peut-on rouler sans adblue,261
installer une pompe de relevage,262
urée faible voiture,263
pompe vidange piscine,264
surpresseur pour augmenter la pression d'eau,265
adblue urine,266
eau de pluie toilettes,267
remontée nappe phréatique cave,268
eau dans la cave,269
pressostat surpresseur reglage,270
pompe avec surpresseur pour puit,271
pompe qui aspire l'eau,272
fabricant de tracteurs,273
duree de vie vessie surpresseur,274
gnr dans voiture,275
pompe de puit avec surpresseur,276
comment augmenter la pression de la douche,277
d'ou vient l'urée de l'adblue,278
recuperateur d'eau de pluie resistant au gel,279
recuperation tva essence,280
pompe de relevage drainage,281
installation de pompe de relevage,282
pompe vide piscine,283
récupération tva carburant,284
quel surpresseur choisir pour une maison,285
difference adblue 22241 et 22241 1,286
contacteur thermique,287
adblue camioane,288
prix litre adblue,289
recuperateur d eau de pluie resistant au gel,290
contrôle réglementaire cuve fioul,291
protection thermique moteur,292
pompe de relevage en panne qui appeler,293
ou trouver du fioul domestique en station service,294
reglage pression vessie surpresseur,295
eau de pluie traitement,296
pompe de relevage fonction,297
vide cave piscine,298
vide piscine,299
norme cuve fioul,300
réglementation récupération eau de pluie,301
installation cuve fioul,302
achat gnr particulier,303
pompe aspirer eau,304
prix au litre adblue,305
toilette eau de pluie,306
surpresseur pompe puit,307
pompe vide sanitaire,308
qu'est ce qu'une pompe de relevage,309
prix du litre adblue,310
pression eau faible,311
pompe vide cave installation,312
pompe de surpression,313
réserve adblue camion combien de km,314
pompe de relevage vide sanitaire,315
gasoil blanc,316
ma pompe ne démarre pas automatiquement,317
pompe pour vidanger une piscine,318
adblue prix au litre,319
schema alimentation wc eau de pluie,320
pompe vide cave pour piscine,321
pompe de relevage entretien,322
vider piscine avec pompe filtration,323
mon pressostat ne coupe pas la pompe,324
fonctionnement pompe de relevage eaux pluviales,325
qu'est-ce qu'une pompe de relevage,326
pompe vider piscine avec tuyau,327
marque tracteur,328
pompe de relevage pour vide sanitaire,329
marques tracteurs,330
urine adblue,331
pompe aspire eau,332
inondations maison,333
recuperer l'eau de pluie,334
prix de adblue,335
augmenter pression eau douche,336
inondation dans la maison,337
recuperer l'eau de pluie pour les wc,338
adblue fabrication,339
problème de pompe à eau de puit,340
temoin adblue,341
vider cave,342
comment faire quand on a pas de pression d'eau,343
voyant ad blue,344
pompe pour puit profondeur 8 m,345
debit d'eau reduit,346
recuperer l eau de pluie,347
faut il fixer un recuperateur d'eau au mur,348
quel carburant pour un tracteur agricole pour un particulier,349
arrosage pompe immergée,350
pompe surpresseur pour puit,351
prix de l adblue,352
pompe pour vide sanitaire,353
tracteur marque,354
pompe à surpression,355
marque tracteurs,356
comment gonfler un ballon surpresseur,357
durée de vie vessie surpresseur,358
combien de km en réserve poids lourd,359
prix adblue a la pompe,360
raccordement de plomberie,361
marque de tracteur agricole,362
prix du litre adblue à la pompe,363
fonctionnement pompe eau,364
adblue composition urine,365
prix ad blue,366
cuve pour pompe de puit,367
prix de l'adblue à la pompe,368
litre adblue,369
pompe eau arrosage,370
eau de pluie pour wc,371
combien de temps peut on rouler sans adblue,372
traitement de l'eau de pluie,373
probleme flotteur pompe de relevage,374
entretien des pompes de relevage,375
tracteurs marques,376
autonomie adblue,377
carburant tracteur,378
prix du litre d'adblue,379
pompe pour arrosage jardin,380
pompe vide cave puissante,381
reglage pressostat surpresseur,382
pompe aspiration eau électrique,383
pompe d'arrosage jardin,384
inondation cave que faire,385
wc eau de pluie,386
fabrication adblue,387
stocker eau de pluie,388
réserve adblue renault t combien de km,389
installation pompe de relevage,390
eau vide sanitaire pas grave,391
prix bidon adblue,392
pompe de relevage pour climatiseur,393
pompe a eau tourne mais n'aspire pas,394
remplacer adblue par eau déminéralisée forum,395
installation d'un surpresseur sur un puit,396
cave inondée quand il pleut,397
prix changement circulateur chaudière,398
eau de pluie pour douche,399
prix adblue station,400
conservation gasoil bidon plastique,401
adblue station prix,402
vider une cave,403
pompes d'arrosage,404
prix adblue au litre,405
qu'est-ce qu'une pompe de relevage,406
eau dans le vide sanitaire,407
fioul de 20 ans,408
pompe a eau arrosage,409
recuperer tva sur essence,410
cave inondée pompe,411
vide sanitaire rempli d'eau,412
inerter une cuve,413
pompe arrosage jardin,414
débit d'eau faible,415
installation pompe de relevage eau de pluie,416
pompe submersible piscine,417
recuperation de l eau de pluie,418
pompe à eau jardin,419
pompe à eau pour arrosage,420
niveau d'urée voiture,421
reglage surpresseur pressostat,422
fabrication adblue,423
pompe de vidange pour piscine,424
vide sanitaire plein d eau,425
pompe pression eau,426
amorcage pompe eau,427
récupérer eau de pluie,428
prix adblue,429
pompe de surface eau,430
qu'est ce qu'une pompe de relevage,431
pompe a eau pour jardin,432
qu est ce qu une pompe de relevage,433
vide cave pompier,434
pompe à eau arrosage,435
pompe eau jardin,436
eau de pluie toilette,437
transport de carburant réglementation,438
amorcer pompe immergée,439
eau dans la cave qui contacter,440
tva recuperable essence,441
réglage pressostat surpresseur,442
comment degazer une cuve fioul,443
vide sanitaire plein d'eau,444
pourquoi mon surpresseur ne tient pas la pression,445
problème flotteur pompe de relevage,446
pompe a eau pour arrosage,447
eau dans vide sanitaire,448
consommation poids lourd 19t,449
entretien d une pompe de relevage,450
eau de pluie pour la douche,451
recuperation eau de pluie pour wc,452
recuperer eau de pluie pour wc.,453
comment amorcer une pompe de relevage,454
prix adblue à la pompe,455
pompe de relevage pour eau de pluie,456
eau de pluie douche,457
eau de pluie wc,458
comment amorcer une pompe surpresseur,459
problème surpresseur marche par à coup,460
définition pompe de relevage,461
récupération de l'eau de pluie,462
fonctionnement pompe immergée,463
plus de pression d'eau dans toute la maison,464
augmenter pression douche,465
récupération des eaux pluviales,466
prix adblue pompe,467
surpresseur pression,468
panne pompe à eau puits,469
pression reseau eau maison,470
pression d'eau faible,471
eau de pluie pour toilette,472
pompes d arrosage,473
symbole circulateur chauffage,474
marques de tracteur,475
entretien d'une pompe de relevage,476
a quoi sert une pompe a eau,477
jurisprudence vide sanitaire inondé,478
pompe pour arroser le jardin,479
pression d'eau insuffisante,480
voyant adblue,481
installation surpresseur d'eau domestique,482
maison inondée,483
tous les raccords de plomberie,484
faire remonter de l'eau dans un tuyau,485
recuperateur eau de pluie wc,486
pompe pression eau,487
surpresseur et pompe,488
problème de pompe à eau de puit,489
entretien pompe relevage,490
infiltration cave,491
fonctionnement pompe immergée avec flotteur,492
installer un récupérateur d'eau,493
pression douche,494
calculer un volume en litre d'une cuve,495
pompe d arrosage jardin,496
récupérer l eau de pluie,497
cave dans vide sanitaire,498
circulateur d'eau,499
interdit de récupérer l'eau de pluie,500
cave vide sanitaire,501
gasoil agricole,502
composition adblue,503
pompe de relevage vide sanitaire,504
installation pompe vide cave,505
inondation maison,506
pompe de relevage machine à laver brico dépôt,507
stockage adblue,508
pompe a eau pour machine a laver,509
temoin voyant adblue,510
plein adblue,511
conservation adblue,512
pompe de relevage installation,513
eau cave,514
pompe fonctionnement,515
réglage pression eau maison,516
pression pompe eau,517
marques de tracteur agricole,518
pompe d aspiration d eau,519
pompe electrique adblue,520
pompe pour inondation sous-sol,521
relais thermique schéma,522
pression douche faible,523
pompe et surpresseur pour puit,524
installation surpresseur,525
plus de pression dans la douche,526
pompe d arrosage,527
pompe pour vide sanitaire,528
station essence poids lourds,529
norme adblue,530
pompe aspiration eau,531
tracteur marques,532
gasoil rouge,533
pression d eau,534
crepine pompe eau,535
peut-on utiliser du vieux fioul,536
eau dans cave,537
pompe de surpression d'eau,538
surpresseur pour puit,539
toute les marque de tracteur,540
pompe a eau jardin,541
douche eau de pluie,542
amende rouler au rouge,543
calculer volume cuve,544
toute les marques de tracteur,545
pression d'eau,546
pompe pour vider une piscine,547
réglage pression pompe à eau,548
recuperer les eaux pluviales,549
adblue composition,550
hauteur géométrique,551
adblue fabrication,552
pompe pour puit avec surpresseur,553
calcul volume cuve,554
fonctionnement pompe,555
pression eau,556
innondation maison,557
pompe pour aspirer l'eau,558
traitement eau de pluie,559
pompe pour cave inondée,560
interdit recuperer eau de pluie,561
prix adblue total à la pompe,562
volume cuve,563
vider sole,564
melanger gnr et gasoil,565
consommation ad blue,566
comment nettoyer une citerne d'eau en plastique,567
entretien pompe de relevage,568
composition de adblue,569
pompe de jardin,570
pompe vide cave sans flotteur,571
problème pompe à eau maison,572
pompe relevage eau de pluie,573
composition ad blue,574
fioul à la pompe autour de moi,575
recuperation des eaux de pluies,576
installer recuperateur d'eau,577
pompe de relevage eau de pluie,578
adblue consommation,579
de quoi est composé l'adblue,580
ballon surpresseur pression,581
surpresseur pour augmenter la pression d eau,582
cuve fioul vide,583
prix du litre adblue à la pompe total,584
schéma installation pompe de relevage eaux usées,585
prix changement circulateur chaudiere,586
circulateur chaudiere gaz,587
amorcer pompe à eau,588
adblue corrosif,589
calcul volume eau,590
symbole relais thermique,591
station service poids lourds,592
prix d'un litre d'adblue,593
branchement d une pompe de relevage,594
eau vide sanitaire,595
pompes de jardin,596
inondation cave,597
réglage pressostat surpresseur pdf,598
comment fixer un recuperateur d eau au mur,599
pompe vide sanitaire,600
eau de pluie interdiction,601
carburant rouge,602
ad blue composition,603
pompe qui aspire l'eau,604
gonflage vessie surpresseur,605
prix de l'adblue,606
qu est ce qu une pompe de relevage,607
composants adblue,608
installer recuperateur d eau,609
augmenter pression eau maison,610
sur quoi poser un recuperateur d'eau,611
habiller cuve 1000l,612
comment installer une pompe de relevage pour machine à laver,613
fonctionnement relais,614
pompe d'aspiration,615
bidon adblue prix,616
cave inondée,617
pompe eau pression,618
pompe vide cave piscine,619
manomètre pression eau maison,620
eau pression,621
calculer un volume d eau,622
installation cuve fioul plastique,623
comment fixer un recuperateur d'eau au mur,624
pompe pour jardin,625
calculer un volume d'eau,626
loi recuperation eau de pluie,627
surpresseur eau fonctionnement,628
produit nettoyant pompe de relevage,629
récupération des eaux de pluie réglementation,630
pompe pour arrosage,631
volume d'eau,632
circulateur de chaudiere,633
fonctionnement d une pompe,634
aspiration de l'eau,635
pompe cave inondée,636
pression réseau eau,637
pompe de relevage pour vide sanitaire,638
pompe à eau avec tuyau,639
adblue plein mais voyant allume,640
pompe de relevage définition,641
installation pompe de relevage eau de pluie,642
amorcer pompe puit,643
a quoi sert la pompe a eau,644
récupération eau de pluie interdite,645
station essence poids lourd,646
amorçage pompe à eau,647
un surpresseur,648
puisard vide sanitaire,649
surpresseur pour augmenter la pression d'eau,650
tva recuperable sur carburant,651
fonction pompe,652
consommation adblue,653
comment fonctionne une pompe à eau,654
composition de l adblue,655
carburant poid lourd,656
produit nettoyage pompe de relevage,657
cuve à fuel enterrée,658
fonction du relais,659
carburant poids lourds,660
comment fonctionne un relais,661
rouler au gnr hdi,662
station gnr agricole,663
circulateur d eau,664
installer recuperateur eau,665
station-service poids lourds,666
récupération des eaux de pluie,667
voyant adblue combien de km,668
les raccord,669
pompe arrosage,670
vide-cave pompier,671
ma pompe à eau tourne tout le temps,672
pompe inondation cave,673
pompe de relevage bruit en continue,674
augmenter pression pommeau douche,675
gnr definition,676
pompage vide sanitaire,677
pompe aspire eau,678
cuve fuel enterrée,679
adblue toxique,680
carburant poids lourd,681
adblue pompe ou bidon,682
circulateur eau,683
relais fonctionnement,684
neutralisation cuve fioul sable ou béton,685
cuve pour gnr,686
adblue consommation diesel,687
pression reseau eau,688
eau de pluie récupération,689
stockage essence,690
adblue iso 22241 1,691
gnr fuel,692
récupération eau de pluie interdit,693
pompe piscine intex fonctionne mais n'aspire plus,694
recuperation eaux pluviales,695
station essence poid lourd,696
pompe de relevage eaux pluviales,697
couleur gnr,698
pression eau réseau,699
augmenter pression d eau insuffisante,700
pompe adblue prix,701
pompe de drainage,702
eau dans cave,703
panne pompe à eau puits,704
calcul volume d'eau,705
ad blue prix,706
gonfler vessie surpresseur,707
récupérer eaux de pluie,708
moteur surpresseur,709
habillage cuve 1000l,710
station fioul autour de moi,711
recuperation des eaux de pluie,712
pompe de relevage pour clim,713
pompe eau potable,714
recuperation eau pluviale,715
comment fonctionne un surpresseur,716
fonction relais,717
comment recuperer l'eau de pluie,718
cuve fioul enterrée durée vie,719
interdiction de recuperer l eau de pluie,720
pompe vide cave gros debit,721
amplificateur de pression d'eau,722
tva déductible essence,723
recuperation eau de pluie amende,724
recuperation des eaux pluviales,725
regler pression eau,726
pourquoi ma pompe à eau ne monte pas en pression,727
eau dans la cave quand il pleut,728
recup eau de pluie,729
composition de l'adblue,730
recuperation tva sur carburant,731
pression de l'eau,732
volume eau,733
pompe surpresseur puit,734
comment est fait l'adblue,735
eau de pluie utilisation,736
raccordement pompe de relevage,737
essence tva,738
pompe de relevage eau pluviale,739
gazole rouge,740
eau dans la cave,741
installation pompe de relevage eaux usées wc,742
relier 2 cuves de 1000l,743
comment récupérer l'eau de pluie,744
debit eau maison,745
comment dégazer une cuve à fioul,746
habillage recuperateur d'eau 1000l,747
récupération eau de pluie,748
hmt,749
pompe relevage eaux pluviales,750
déductibilité tva essence,751
augmenter pression d'eau insuffisante,752
interdiction récupérer eau de pluie,753
mon pressostat ne coupe pas la pompe,754
pompe a eau demarre et s'arrete,755
calcul pression eau hauteur,756
utilisation de l'eau de pluie,757
fonctionnement d'un relais,758
fonctionnement d un relais,759
recuperer tva sur carburant,760
pompes de surface,761
fonctionnement surpresseur eau,762
tva sur l'essence,763
pompe cave inondée,764
fonction d'un relais,765
pompe d'arrosage,766
pompe vide-cave,767
maison neuve eau dans vide sanitaire,768
récupération eaux pluviales,769
recuperateur eau pluviale,770
fonctionnement pompe à eau,771
eau de pluie wc sans pompe,772
pompe à aspiration,773
degazage cuve fuel,774
quand remettre de l adblue,775
nettoyer reservoir gasoil,776
recuperation tva carburant 2024,777
réglage pressostat surpresseur,778
peut on mélanger fioul et gasoil voiture,779
comment nettoyer une cuve à fioul,780
norme adblue,781
adblue combien de km,782
interdiction de recuperer l'eau de pluie,783
fioul agricole,784
schema installation pompe de surface,785
pompe de relevage pour machine à laver en sous-sol,786
pompe pour vider une cave,787
cuve et pompe de relevage,788
recuperation tva carburant,789
fioul rouge,790
essence tva deductible,791
pompe de relevage pour eaux pluviales,792
stockage carburant,793
nettoyage cuve fuel,794
récupération des eaux,795
nettoyage reservoir diesel,796
différente qualité adblue,797
deduction tva carburant,798